{
  "schema_version": 1,
  "manifest_id": "Operation-FileOperate-CombinationDocs-012-gold-v1",
  "distribution_policy": "download_only",
  "entries": [
    {
      "logical_key": "osworld-gold:2c1ebcd7-9c6d-4c9a-afad-900e381ecd5e:expected:0:v1",
      "source_locator": {
        "provider": "huggingface_dataset",
        "repository": "xlangai/ubuntu_osworld_file_cache",
        "revision": "711e0811642364e7aa8f10a8918367d0b626d578",
        "path": "multi_apps/2c1ebcd7-9c6d-4c9a-afad-900e381ecd5e/case study gold.docx"
      },
      "runtime_locator": {
        "kind": "cache-relative-path",
        "value": "blobs/0000"
      },
      "size": 16501,
      "sha256": "8dee945aea1932a50da5600e6eedd37316b5cc70ef944a991e9f0666d763cd57",
      "media_type": "application/vnd.openxmlformats-officedocument.wordprocessingml.document",
      "license": {
        "status": "verified",
        "spdx_expression": "Apache-2.0",
        "evidence_ref": "https://huggingface.co/datasets/xlangai/ubuntu_osworld_file_cache",
        "distribution": "download_only"
      },
      "provenance": {
        "source_benchmark": "OSWorld",
        "source_task_id": "2c1ebcd7-9c6d-4c9a-afad-900e381ecd5e",
        "source_evaluator_id": "2c1ebcd7-9c6d-4c9a-afad-900e381ecd5e",
        "expected_index": 0,
        "source_contract_sha256": "4780cfb96a299a1e8b30ab369fe767150164ee6140dd747ca7e017ecbe8bc948",
        "evidence_ref": "osworld:evaluator:2c1ebcd7-9c6d-4c9a-afad-900e381ecd5e:expected:0"
      }
    }
  ]
}
