{
  "schema_version": 1,
  "manifest_id": "Operation-FileOperate-CombinationDocs-011-gold-v1",
  "distribution_policy": "download_only",
  "entries": [
    {
      "logical_key": "osworld-gold:337d318b-aa07-4f4f-b763-89d9a2dd013f:expected:0:v1",
      "source_locator": {
        "provider": "huggingface_dataset",
        "repository": "xlangai/ubuntu_osworld_file_cache",
        "revision": "711e0811642364e7aa8f10a8918367d0b626d578",
        "path": "multi_apps/337d318b-aa07-4f4f-b763-89d9a2dd013f/Invoice # 243729.pdf"
      },
      "runtime_locator": {
        "kind": "cache-relative-path",
        "value": "blobs/0000"
      },
      "size": 15655,
      "sha256": "39c23a5792795583184c3694de5b0187d895e6ef75d2e2cbfbdd16b23f1c3594",
      "media_type": "application/pdf",
      "license": {
        "status": "verified",
        "spdx_expression": "Apache-2.0",
        "evidence_ref": "https://huggingface.co/datasets/xlangai/ubuntu_osworld_file_cache",
        "distribution": "download_only"
      },
      "provenance": {
        "source_benchmark": "OSWorld",
        "source_task_id": "337d318b-aa07-4f4f-b763-89d9a2dd013f",
        "source_evaluator_id": "337d318b-aa07-4f4f-b763-89d9a2dd013f",
        "expected_index": 0,
        "source_contract_sha256": "846c0629ec2dde2f18a34807e9c0b899260fff5de22fd0cd710d5df3170e94f7",
        "evidence_ref": "osworld:evaluator:337d318b-aa07-4f4f-b763-89d9a2dd013f:expected:0"
      }
    }
  ]
}
